{
  "$schema": "http://json-schema.org/draft-07/schema#",
  "title": "Chunk",
  "description": "A stable evidence object derived from a canonical document by the chunker. Index-time retrieval artifacts are derived separately.",
  "type": "object",
  "required": [
    "chunk_id",
    "document_id",
    "source_ref",
    "locator",
    "chunk_type",
    "content"
  ],
  "additionalProperties": false,
  "properties": {
    "chunk_id": {
      "type": "string",
      "description": "Unique identifier for this chunk"
    },
    "document_id": {
      "type": "string",
      "description": "Identifier of the canonical document this chunk came from"
    },
    "source_ref": {
      "$ref": "./common.schema.json#/$defs/sourceRef"
    },
    "locator": {
      "$ref": "./common.schema.json#/$defs/locator"
    },
    "chunk_type": {
      "type": "string",
      "enum": [
        "rule_section",
        "subsection",
        "spell_entry",
        "feat_entry",
        "skill_entry",
        "class_feature",
        "condition_entry",
        "glossary_entry",
        "stat_block",
        "table",
        "example",
        "sidebar",
        "errata_note",
        "faq_note",
        "paragraph_group",
        "generic"
      ],
      "description": "Semantic chunk type used for retrieval and later citation logic"
    },
    "content": {
      "type": "string",
      "description": "Text content of this chunk"
    },
    "parent_chunk_id": {
      "type": "string",
      "description": "Optional parent chunk identifier when the chunk belongs to a larger entry or table"
    },
    "previous_chunk_id": {
      "type": "string",
      "description": "Optional previous adjacent chunk identifier"
    },
    "next_chunk_id": {
      "type": "string",
      "description": "Optional next adjacent chunk identifier"
    },
    "chunk_version": {
      "type": "string",
      "description": "Optional version or strategy marker for regenerated chunks"
    },
    "split_origin": {
      "type": "string",
      "enum": ["structure_cut", "paragraph_group"],
      "description": "Optional provenance marker for child chunks indicating which split mechanism produced them"
    }
  }
}
