{
  "chunk_id": "chunk::srd_35::psionicpowersd_f::117_power_points_13",
  "document_id": "srd_35::psionicpowersd_f::117_power_points_13",
  "source_ref": {
    "source_id": "srd_35",
    "title": "System Reference Document",
    "edition": "3.5e",
    "source_type": "srd",
    "authority_level": "official_reference"
  },
  "locator": {
    "section_path": [
      "PsionicPowersD-F",
      "Power Points: 13"
    ],
    "source_location": "PsionicPowersD-F.rtf#117_power_points_13"
  },
  "chunk_type": "subsection",
  "content": "You can divide yourself, creating a duplicate that comes into existence 5 feet away. Your duplicate thinks and acts exactly as you do and follows your orders, although it will not do anything you wouldn't do yourself. Your duplicate has all your abilities but none of your psionic or magical equipment (it does possess a duplicate of all your mundane equipment, clothing, armor, and implements, as well as mundane versions of any psionic or magical equipment you have). You and your duplicate evenly split your power points, your remaining usages of pertinent special abilities for the day, and so on. You retain your psionic focus, if you maintain such when this power is manifested. Treat your duplicate as yourself with two negative levels for the purpose of determining the powers to which the duplicate has access (while the duration of this power lasts, those negative levels cannot be removed by any means). Your duplicate has all other physical traits you had at the time you manifest this power. Powers, spells, or other effects affecting you when you manifest this power do not transfer to your duplicate.\nWhen the duration expires or when you dismiss the power, you and your duplicate rejoin, no matter how far from each other you are. You gain back any power points the duplicate has not spent. At the time of rejoining, you take half of the damage your duplicate has taken since this power was manifested. This damage could potentially leave you with negative hit points, but it can't reduce your hit points to less than -9.\nIf your duplicate dies before the duration expires, no rejoining occurs, and you gain one negative level. If you die, your duplicate remains in existence, and is for all intents you, but with two negative levels. (Once the duration expires, one of the negative levels immediately converts to one lost level; the other negative level can be removed by standard means.)\nYou can have only one fissioned duplicate in existence at one time; your duplicate cannot use this power. You cannot use fusion or metaconcert with a duplicate, or share any other power or effect that pools abilities (the sum of you and you is still just you). Similarly, attempting to use powers such as claws of the vampire or vampiric blade to hurt your duplicate only damages your duplicate; these powers do not heal you. Empathic transfer and similar powers are likewise ineffective (transferring wounds to yourself isn't a good healing strategy).\nAll powers affecting a fissioned creature, either the original or the duplicate, end when the fission ends. All damage, including hit point damage, ability damage, ability drain, and ability burn damage, is added together.",
  "chunk_version": "v1-section-passthrough",
  "previous_chunk_id": "chunk::srd_35::psionicpowersd_f::116_power_points_9",
  "next_chunk_id": "chunk::srd_35::psionicpowersd_f::118_psychoportation"
}
