{
  "chunk_id": "chunk::srd_35::psionicpowersq_w::048_display_visual",
  "document_id": "srd_35::psionicpowersq_w::048_display_visual",
  "source_ref": {
    "source_id": "srd_35",
    "title": "System Reference Document",
    "edition": "3.5e",
    "source_type": "srd",
    "authority_level": "official_reference"
  },
  "locator": {
    "section_path": [
      "PsionicPowersQ-W",
      "Display: Visual"
    ],
    "source_location": "PsionicPowersQ-W.rtf#048_display_visual"
  },
  "chunk_type": "subsection",
  "content": "Manifesting Time: 1 standard action\nRange: Medium (100 ft. + 10 ft./ level)\nTarget: One object at a time\nDuration: Concentration, up to 1 round/level\nSaving Throw: Will negates (object); see text",
  "chunk_version": "v1-section-passthrough",
  "previous_chunk_id": "chunk::srd_35::psionicpowersq_w::047_power_points_1",
  "next_chunk_id": "chunk::srd_35::psionicpowersq_w::049_power_points_5"
}
