{
  "chunk_id": "chunk::srd_35::epicmagicitems1::010_epic_armor_and_shield_base_price",
  "document_id": "srd_35::epicmagicitems1::010_epic_armor_and_shield_base_price",
  "source_ref": {
    "source_id": "srd_35",
    "title": "System Reference Document",
    "edition": "3.5e",
    "source_type": "srd",
    "authority_level": "official_reference"
  },
  "locator": {
    "section_path": [
      "EpicMagicItems1",
      "EPIC ARMOR AND SHIELD BASE PRICE"
    ],
    "source_location": "EpicMagicItems1.rtf#010_epic_armor_and_shield_base_price"
  },
  "chunk_type": "subsection",
  "content": "To find the base price of an epic suit of magic armor or an epic magic shield, roll on Table: Armor and Shields. Note that the +6 to +10 rows apply only to armor and shields that provide an enhancement bonus of +6 to +10 or armor and shields with a single special ability whose market price modifier is +6 to +10. Magic armor and shields with a total effective bonus of +6 to +10 but that have an enhancement bonus of +5 or less and special abilities whose individual market price modifiers are +5 or less use the table for nonepic magic armor to determine price.\n\nd% | Enhancement Bonus | Market Price |\n01 | +1 shield 1 | +1,000 gp |\n02 | +1 armor 2 | +1,000 gp |\n03 | +2 shield 1 | +4,000 gp |\n04 | +2 armor 2 | +4,000 gp |\n05-06 | +3 shield 1 | +9,000 gp |\n07-08 | +3 armor 2 | +9,000 gp |\n09-12 | +4 shield 1 | +16,000 gp |\n13-16 | +4 armor 2 | +16,000 gp |\n17-21 | +5 shield 1 | +25,000 gp |\n22-26 | +5 armor 2 | +25,000 gp |\n27-30 | +6 shield | +360,000 gp |\n31-34 | +6 armor | +360,000 gp |\n35-38 | +7 shield | +490,000 gp |\n39-42 | +7 armor | +490,000 gp |\n43-45 | +8 shield | +640,000 gp |\n46-48 | +8 armor | +640,000 gp |\n49-50 | +9 shield | +810,000 gp |\n51-52 | +9 armor | +810,000 gp |\n53-54 | +10 shield | +1,000,000 gp |\n55-56 | +10 armor | +1,000,000 gp |\n57-62 | Specific armor or shield 3 |\n63-75 | Armor with special ability and roll again 4 |\n76-98 | Shield with special ability and roll again 4 |\n99 | Epic shield 5 |\n100 | Epic armor 5 |\n1 Roll also on nonepic magic item Table: Shield Special Abilities. |\n2 Roll also on nonepic magic item Table: Armor Special Abilities. |\n\nd% | Enhancement Bonus | Market Price |\n01-21 | +11 | +1,210,000 gp |\n22-39 | +12 | +1,440,000 gp |\n40-54 | +13 | +1,690,000 gp |\n55-66 | +14 | +1,960,000 gp |\n67-76 | +15 | +2,250,000 gp |\n77-84 | +16 | +2,560,000 gp |\n85-90 | +17 | +2,890,000 gp |\n91-94 | +18 | +3,240,000 gp |\n95-97 | +19 | +3,610,000 gp |\n98-99 | +20 | +4,000,000 gp |\n100 | Roll again and add +10 to bonus 1 | 2 |\n1 This is cumulative if rolled multiple times. | |\n2 For enhancement bonuses higher than +20, the market price modifier is equal to the square of the bonus x10,000 gp. |\n\nd% | Armor | Armor Cost 1 |\n01 | Padded | +155 gp |\n02 | Leather | +160 gp |\n03-12 | Hide | +165 gp |\n13-27 | Studded leather | +175 gp |\n28-42 | Chain shirt 2 | +250 gp |\n43 | Scale mail 2 | +200 gp |\n44 | Chainmail 2 | +300 gp |\n45-57 | Breastplate 2 | +350 gp |\n58 | Splint mail 2 | +350 gp |\n59 | Banded mail 2 | +400 gp |\n60 | Half-plate 2 | +750 gp |\n61-100 | Full plate 2 | +1,650 gp |\nAll magic armor is masterwork armor (with an armor check penalty 1 lower than normal). |\n1 Add to enhancement bonus on Table: Epic Armor and Shields to determine total market price. |\n2 Roll d% to determine material: 01-70 steel; 71-90 mithral; 91-99 adamantine; 100 other. Adjust price accordingly. |\n\nd% | Shield | Shield Cost 1 |\n01-10 | Buckler | +165 gp |\n11-15 | Shield, light wooden 2 | +153 gp |\n16-20 | Shield, light steel 3 | +159 gp |\n21-30 | Shield, heavy wooden 2 | +157 gp |\n31-95 | Shield, heavy steel 3 | +170 gp |\n96-100 | Shield, tower 2 | +180 gp |\nAll magic shields are masterwork shields (with an armor check penalty 1 lower than normal). |\n1 Add to enhancement bonus on Table: Epic Armor and Shields to determine total market price. |\n2 Roll d% to determine material: 01-70 wood; 71-99 dark-wood; 100 other. Adjust price accordingly. |\n3 Roll d% to determine material: 01-70 steel; 71-90 mithral; 91-99 adamantine; 100 other. Adjust price accordingly. |\n\nd% | Special Ability | Market Price Modifier 1 |\n01-06 | Great invulnerability (10/magic) | +4 bonus |\n07-11 | Great invulnerability (15/magic) | +5 bonus |\n12-19 | Negating | +5 bonus |\n20-26 | Acid warding | +6 bonus |\n27-33 | Cold warding | +6 bonus |\n34-40 | Fire warding | +6 bonus |\n41-44 | Great invulnerability (5/epic) | +6 bonus |\n45-50 | Great spell resistance (SR 21) | +6 bonus |\n51-57 | Lightning warding | +6 bonus |\n58-64 | Sonic warding | +6 bonus |\n65-67 | Great invulnerability (10/epic) | +7 bonus |\n68-72 | Great spell resistance (SR 23) | +7 bonus |\n73-76 | Great spell resistance (SR 25) | +8 bonus |\n77-79 | Great spell resistance (SR 27) | +9 bonus |\n80-87 | Roll on nonepic magic item Table: Armor Special Abilities, then roll again on this table. |\n88-95 | Roll twice on nonepic magic item Table: Armor Special Abilities. |\n96-100 | Roll twice again 2 |\n1 Add to enhancement bonus on Table: Epic Armor and Shields to determine total market price. |\n2 If a special ability is rolled twice, only one counts. If two versions of the same special ability are rolled, use the better. |\n\nd% | Shield Special Ability | Market Price Modifier 1 |\n01-06 | Great invulnerability (10/magic) | +4 bonus |\n07-12 | Great invulnerability (15/magic) | +5 bonus |\n13-19 | Acid warding | +6 bonus |\n20-26 | Cold warding | +6 bonus |\n27-33 | Fire warding | +6 bonus |\n34-37 | Great invulnerability (5/epic) | +6 bonus |\n38-43 | Great spell resistance (SR 21) | +6 bonus |\n44-46 | Infinite arrow deflection | +6 bonus |\n47-53 | Lightning warding | +6 bonus |\n54-60 | Sonic warding | +6 bonus |\n61-63 | Great invulnerability (10/epic) | +7 bonus |\n64-68 | Great spell resistance (SR 23) | +7 bonus |\n69-71 | Exceptional arrow deflection | +8 bonus |\n72-75 | Great spell resistance (SR 25) | +8 bonus |\n76-78 | Great spell resistance (SR 27) | +9 bonus |\n79 | Great reflection | +10 bonus |\n80-87 | Roll on nonepic magic item Table: Shield Special Abilities, then roll again on this table. |\n88-95 | Roll twice on nonepic magic item Table: Shield Special Abilities. |\n96-100 | Roll twice again 2 |\n1 Add to enhancement bonus on Table: Epic Armor and Shields to determine total market price. |\n2 If you roll a special ability twice, only one counts. If you roll two versions of the same special ability, use the better. |",
  "chunk_version": "v1-section-passthrough",
  "previous_chunk_id": "chunk::srd_35::epicmagicitems1::009_armor",
  "next_chunk_id": "chunk::srd_35::epicmagicitems1::011_epic_armor_and_shield_special_ability_descriptions"
}
