{
  "chunk_id": "chunk::srd_35::divineabilitiesandfeats::047_divine_spell_focus",
  "document_id": "srd_35::divineabilitiesandfeats::047_divine_spell_focus",
  "source_ref": {
    "source_id": "srd_35",
    "title": "System Reference Document",
    "edition": "3.5e",
    "source_type": "srd",
    "authority_level": "official_reference"
  },
  "locator": {
    "section_path": [
      "DivineAbilitiesandFeats",
      "Divine Spell Focus"
    ],
    "source_location": "DivineAbilitiesandFeats.rtf#047_divine_spell_focus"
  },
  "chunk_type": "subsection",
  "content": "Prerequisites: Spell Focus, Greater Spell Focus.\nBenefit: The deity chooses one school of magic. The save DC for any spell of that school increases by one-half the deity's divine rank. This bonus overlaps (does not stack with) the bonus from Spell Focus or Greater Spell Focus.\nNotes: A deity can have this ability multiple times, choosing a different school of magic each time.\nSuggested Portfolio Elements: Magic.",
  "chunk_version": "v1-section-passthrough",
  "previous_chunk_id": "chunk::srd_35::divineabilitiesandfeats::046_divine_sneak_attack",
  "next_chunk_id": "chunk::srd_35::divineabilitiesandfeats::048_divine_spellcasting"
}
