{
  "chunk_id": "chunk::srd_35::traps::020_cr_6_traps",
  "document_id": "srd_35::traps::020_cr_6_traps",
  "source_ref": {
    "source_id": "srd_35",
    "title": "System Reference Document",
    "edition": "3.5e",
    "source_type": "srd",
    "authority_level": "official_reference"
  },
  "locator": {
    "section_path": [
      "Traps",
      "CR 6 Traps"
    ],
    "source_location": "Traps.rtf#020_cr_6_traps"
  },
  "chunk_type": "subsection",
  "content": "Built-to-Collapse Wall: CR 6; mechanical; proximity trigger; no reset; Atk +20 melee (8d6, stone blocks); multiple targets (all targets in a 10-ft.-by-10-ft. area); Search DC 14; Disable Device DC 16. Market Price: 15,000 gp.\nCompacting Room: CR 6; mechanical; timed trigger; automatic reset; hidden switch bypass (Search DC 25); walls move together (12d6, crush); multiple targets (all targets in a 10-ft.-by- 10-ft. room); never miss; onset delay (4 rounds); Search DC 20; Disable Device DC 22. Market Price: 25,200 gp.\nFlame Strike Trap: CR 6; magic device; proximity trigger (detect magic); automatic reset; spell effect (flame strike, 9th-level cleric, 9d6 fire, DC 17 Reflex save half damage); Search DC 30; Disable Device DC 30. Cost: 22,750 gp, 1,820 XP.\nFusillade of Spears: CR 6; mechanical; proximity trigger; repair reset; Atk +21 ranged (1d8, spear); multiple targets (1d6 spears per target in a 10 ft.-by-10-ft. area); Search DC 26; Disable Device DC 20. Market Price: 31,200 gp.\nGlyph of Warding (Blast): CR 6; spell; spell trigger; no reset; spell effect (glyph of warding [blast], 16th-level cleric, 8d8 sonic, DC 14 Reflex save half damage); multiple targets (all targets within 5 ft.); Search DC 28; Disable Device DC 28. Cost: 680 gp to hire NPC spellcaster.\nLightning Bolt Trap: CR 6; magic device; proximity trigger (alarm); automatic reset; spell effect (lightning bolt, 10th-level wizard, 10d6 electricity, DC 14 Reflex save half damage); Search DC 28; Disable Device DC 28. Cost: 15,000 gp, 1,200 XP.\nSpiked Blocks from Ceiling: CR 6; mechanical; location trigger; repair reset; Atk +20 melee (6d6, spikes); multiple targets (all targets in a 10-ft.-by-10-ft. area); Search DC 24; Disable Device DC 20. Market Price: 21,600 gp.\nSpiked Pit Trap (100 Ft. Deep): CR 6; mechanical; location trigger, manual reset; DC 20 Reflex save avoids; 100 ft. deep (10d6, fall); pit spikes (Atk +10 melee, 1d4 spikes per target for 1d4+5 each); Search DC 20; Disable Device DC 20. Market Price: 6,000 gp.\nWhirling Poison Blades: CR 6; mechanical; timed trigger; automatic reset; hidden lock bypass (Search DC 25, Open Lock DC 30); Atk +10 melee (1d4+4/19-20 plus poison, dagger); poison (purple worm poison, DC 24 Fortitude save resists, 1d6 Str/2d6 Str); multiple targets (one target in each of three preselected 5-ft. squares); Search DC 20; Disable Device DC 20. Market Price: 30,200 gp.\nWide-Mouth Pit Trap: CR 6; mechanical; location trigger, manual reset; DC 25 Reflex save avoids; 40 ft. deep (4d6, fall); multiple targets (all targets within a 10-ft.-by-10-ft. area); Search DC 26; Disable Device DC 25. Market Price: 28,200 gp.\nWyvern Arrow Trap: CR 6; mechanical; proximity trigger; manual reset; Atk +14 ranged (1d8 plus poison, arrow); poison (wyvern poison, DC 17 Fortitude save resists, 2d6 Con/2d6 Con); Search DC 20; Disable Device DC 16. Market Price: 17,400 gp.",
  "chunk_version": "v1-section-passthrough",
  "previous_chunk_id": "chunk::srd_35::traps::019_cr_5_traps",
  "next_chunk_id": "chunk::srd_35::traps::021_cr_7_traps"
}
