{
  "chunk_id": "chunk::srd_35::psionicpowersd_f::076_power_points_5",
  "document_id": "srd_35::psionicpowersd_f::076_power_points_5",
  "source_ref": {
    "source_id": "srd_35",
    "title": "System Reference Document",
    "edition": "3.5e",
    "source_type": "srd",
    "authority_level": "official_reference"
  },
  "locator": {
    "section_path": [
      "PsionicPowersD-F",
      "Power Points: 5"
    ],
    "source_location": "PsionicPowersD-F.rtf#076_power_points_5"
  },
  "chunk_type": "subsection",
  "content": "Upon manifesting this power, you choose cold, electricity, fire, or sonic. You create an explosion of unstable ectoplasmic energy of the chosen type that deals 5d6 points of damage to every creature or object within the area. The explosion creates almost no pressure. Since this power extends outward from you, you are not affected by the damage.\nCold: A burst of this energy type deals +1 point of damage per die. The saving throw to reduce damage from a cold burst is a Fortitude save instead of a Reflex save.\nElectricity: Manifesting a burst of this energy type provides a +2 bonus to the save DC and a +2 bonus on manifester level checks for the purpose of overcoming power resistance.\nFire: A burst of this energy type deals +1 point of damage per die.\nSonic: A burst of this energy type deals -1 point of damage per die and ignores an object's hardness.\nThis power's subtype is the same as the type of energy you manifest.\nAugment: For every additional power point you spend, this power's damage increases by one die (d6). For each extra two dice of damage, this power's save DC increases by 1.\nEnergy Cone\nPsychokinesis [see text]",
  "chunk_version": "v1-section-passthrough",
  "previous_chunk_id": "chunk::srd_35::psionicpowersd_f::075_display_auditory",
  "next_chunk_id": "chunk::srd_35::psionicpowersd_f::077_display_auditory"
}
