{
  "chunk_id": "chunk::srd_35::epicfeats::125_perfect_health_epic",
  "document_id": "srd_35::epicfeats::125_perfect_health_epic",
  "source_ref": {
    "source_id": "srd_35",
    "title": "System Reference Document",
    "edition": "3.5e",
    "source_type": "srd",
    "authority_level": "official_reference"
  },
  "locator": {
    "section_path": [
      "EpicFeats",
      "PERFECT HEALTH [EPIC]"
    ],
    "source_location": "EpicFeats.rtf#125_perfect_health_epic"
  },
  "chunk_type": "subsection",
  "content": "Prerequisite: Con 25, Great Fortitude.\nBenefit: The character is immune to all nonmagical diseases, as well as to all poisons whose Fortitude save DC is 25 or less.",
  "chunk_version": "v1-section-passthrough",
  "previous_chunk_id": "chunk::srd_35::epicfeats::124_penetrate_damage_reduction_epic",
  "next_chunk_id": "chunk::srd_35::epicfeats::126_perfect_multiweapon_fighting_epic"
}
