{
  "chunk_id": "chunk::srd_35::feats::107_trample_general",
  "document_id": "srd_35::feats::107_trample_general",
  "source_ref": {
    "source_id": "srd_35",
    "title": "System Reference Document",
    "edition": "3.5e",
    "source_type": "srd",
    "authority_level": "official_reference"
  },
  "locator": {
    "section_path": [
      "Feats",
      "TRAMPLE [GENERAL]"
    ],
    "source_location": "Feats.rtf#107_trample_general"
  },
  "chunk_type": "subsection",
  "content": "Prerequisites: Ride 1 rank, Mounted Combat.\nBenefit: When you attempt to overrun an opponent while mounted, your target may not choose to avoid you. Your mount may make one hoof attack against any target you knock down, gaining the standard +4 bonus on attack rolls against prone targets.\nSpecial: A fighter may select Trample as one of his fighter bonus feats.",
  "chunk_version": "v1-section-passthrough",
  "previous_chunk_id": "chunk::srd_35::feats::106_track_general",
  "next_chunk_id": "chunk::srd_35::feats::108_two_weapon_defense_general"
}
