{
  "chunk_id": "chunk::srd_35::psionicclasses::029_class_features",
  "document_id": "srd_35::psionicclasses::029_class_features",
  "source_ref": {
    "source_id": "srd_35",
    "title": "System Reference Document",
    "edition": "3.5e",
    "source_type": "srd",
    "authority_level": "official_reference"
  },
  "locator": {
    "section_path": [
      "PsionicClasses",
      "Class Features"
    ],
    "source_location": "PsionicClasses.rtf#029_class_features"
  },
  "chunk_type": "subsection",
  "content": "All the following are class features of the metamind prestige class.\nWeapon and Armor Proficiency: Metaminds gain no proficiency with any weapon or armor.\nPowers Known: At every even-numbered level, a metamind gains additional power points per day and access to new powers as if he had also gained a level in whatever manifesting class he belonged to before he added the prestige class. He does not, however, gain any other benefit a character of that class would have gained (bonus feats, metapsionic or item creation feats, and so on). This essentially means that he adds the level of metamind to the level of whatever manifesting class the character has, then determines power points per day, powers known, and manifester level accordingly.\nIf a character had more than one manifesting class before he became a metamind, he must decide to which class he adds the new level of metamind for the purpose of determining power points per day, powers known, and manifester level.\nFree Manifesting (Ps): At 1st level, a metamind can manifest any 1st-level power he knows for free (without spending power points) three times per day.\nAt higher levels, a metamind gains the ability to freely manifest additional higher-level powers: three 2nd-level powers per day at 3rd level; one 3rd-level power per day at 5th level; one 4th-level power per day at 7th level; and one 5th-level power per day at 9th level.\nThis benefit applies only to the power point cost of an unaugmented power. Points spent to augment a power and an experience point cost (if any) must be paid as normal.\nCognizance Psicrystal (Ex): At 2nd level, a metamind masters the trick of storing excess power points in a psicrystal. The psicrystal is now treated as a cognizance crystal capable of storing 5 power points, in addition to its psicrystal abilities. At every even-numbered level, a metamind becomes able to store an additional 2 power points in his psicrystal, to a maximum of 11 points at 8th level.\nFont of Power (Ps): A 10th-level metamind can act as a living cognizance crystal, producing seemingly endless power points once per day, for up to 1 minute. His eyes shine like tiny stars, and faint illumination seems to beam out of his mouth and the end of each of his fingers. While so empowered, he can manifest any of his powers without drawing from his power point reserve. He finds the power points he needs welling up within his own body.\nIf a metamind using this ability enters a metaconcert, his power point reserve is accessed normally for the purpose of his contributing to the pool.\nPSION UNCARNATE\nHit Die: d4.",
  "chunk_version": "v1-section-passthrough",
  "previous_chunk_id": "chunk::srd_35::psionicclasses::028_class_skills",
  "next_chunk_id": "chunk::srd_35::psionicclasses::030_requirements"
}
