{
  "chunk_id": "chunk::srd_35::psionicpowersd_f::013_power_points_1",
  "document_id": "srd_35::psionicpowersd_f::013_power_points_1",
  "source_ref": {
    "source_id": "srd_35",
    "title": "System Reference Document",
    "edition": "3.5e",
    "source_type": "srd",
    "authority_level": "official_reference"
  },
  "locator": {
    "section_path": [
      "PsionicPowersD-F",
      "Power Points: 1"
    ],
    "source_location": "PsionicPowersD-F.rtf#013_power_points_1"
  },
  "chunk_type": "subsection",
  "content": "You fill your enemies with self-doubt. Any enemy in the area that fails its save becomes shaken for the duration of the power. Allies and creatures without an Intelligence score are unaffected.\nAugment: For every 2 additional power points you spend, this power's range and the radius of its area both increase by 5 feet, and the power's save DC increases by 1.\n\nDisplay: Material and mental\nManifesting Time: 1 standard action\n\nTarget: Creature touched\nDuration: 1 round/level",
  "chunk_version": "v1-section-passthrough",
  "previous_chunk_id": "chunk::srd_35::psionicpowersd_f::012_power_points_1",
  "next_chunk_id": "chunk::srd_35::psionicpowersd_f::014_power_points_1"
}
