{
  "chunk_id": "chunk::srd_35::skillsi::021_climb_str_armor_check_penalty",
  "document_id": "srd_35::skillsi::021_climb_str_armor_check_penalty",
  "source_ref": {
    "source_id": "srd_35",
    "title": "System Reference Document",
    "edition": "3.5e",
    "source_type": "srd",
    "authority_level": "official_reference"
  },
  "locator": {
    "section_path": [
      "SkillsI",
      "CLIMB (STR; ARMOR CHECK PENALTY)"
    ],
    "source_location": "SkillsI.rtf#021_climb_str_armor_check_penalty"
  },
  "chunk_type": "subsection",
  "content": "Check: With a successful Climb check, you can advance up, down, or across a slope, a wall, or some other steep incline (or even a ceiling with handholds) at one-quarter your normal speed. A slope is considered to be any incline at an angle measuring less than 60 degrees; a wall is any incline at an angle measuring 60 degrees or more.\nA Climb check that fails by 4 or less means that you make no progress, and one that fails by 5 or more means that you fall from whatever height you have already attained.\nA climber's kit gives you a +2 circumstance bonus on Climb checks.\nThe DC of the check depends on the conditions of the climb. Compare the task with those on the following table to determine an appropriate DC.\nClimb DC | Example Surface or Activity |\n0 | A slope too steep to walk up, or a knotted rope with a wall to brace against. |\n5 | A rope with a wall to brace against, or a knotted rope, or a rope affected by the rope trick spell. |\n10 | A surface with ledges to hold on to and stand on, such as a very rough wall or a ship's rigging. |\n15 | Any surface with adequate handholds and footholds (natural or artificial), such as a very rough natural rock surface or a tree, or an unknotted rope, or pulling yourself up when dangling by your hands. |\n20 | An uneven surface with some narrow handholds and footholds, such as a typical wall in a dungeon or ruins. |\n25 | A rough surface, such as a natural rock wall or a brick wall. |\n25 | An overhang or ceiling with handholds but no footholds. |\n-- | A perfectly smooth, flat, vertical surface cannot be climbed. |\nClimb DC Modifier1 | Example Surface or Activity |\n-10 | Climbing a chimney (artificial or natural) or other location where you can brace against two opposite walls (reduces DC by 10). |\n-5 | Climbing a corner where you can brace against perpendicular walls (reduces DC by 5). |\n+5 | Surface is slippery (increases DC by 5). |\n1These modifiers are cumulative; use any that apply. |\nYou need both hands free to climb, but you may cling to a wall with one hand while you cast a spell or take some other action that requires only one hand. While climbing, you can't move to avoid a blow, so you lose your Dexterity bonus to AC (if any). You also can't use a shield while climbing.\nAny time you take damage while climbing, make a Climb check against the DC of the slope or wall. Failure means you fall from your current height and sustain the appropriate falling damage.\nAccelerated Climbing: You try to climb more quickly than normal. By accepting a -5 penalty, you can move half your speed (instead of one-quarter your speed).\nMaking Your Own Handholds and Footholds: You can make your own handholds and footholds by pounding pitons into a wall. Doing so takes 1 minute per piton, and one piton is needed per 3 feet of distance. As with any surface that offers handholds and footholds, a wall with pitons in it has a DC of 15. In the same way, a climber with a handaxe or similar implement can cut handholds in an ice wall.\nCatching Yourself When Falling: It's practically impossible to catch yourself on a wall while falling. Make a Climb check (DC = wall's DC + 20) to do so. It's much easier to catch yourself on a slope (DC = slope's DC + 10).\nCatching a Falling Character While Climbing: If someone climbing above you or adjacent to you falls, you can attempt to catch the falling character if he or she is within your reach. Doing so requires a successful melee touch attack against the falling character (though he or she can voluntarily forego any Dexterity bonus to AC if desired). If you hit, you must immediately attempt a Climb check (DC = wall's DC + 10). Success indicates that you catch the falling character, but his or her total weight, including equipment, cannot exceed your heavy load limit or you automatically fall. If you fail your Climb check by 4 or less, you fail to stop the character's fall but don't lose your grip on the wall. If you fail by 5 or more, you fail to stop the character's fall and begin falling as well.\nAction: Climbing is part of movement, so it's generally part of a move action (and may be combined with other types of movement in a move action). Each move action that includes any climbing requires a separate Climb check. Catching yourself or another falling character doesn't take an action.\nSpecial: You can use a rope to haul a character upward (or lower a character) through sheer strength. You can lift double your maximum load in this manner.\nA halfling has a +2 racial bonus on Climb checks because halflings are agile and surefooted.\nThe master of a lizard familiar gains a +3 bonus on Climb checks.\nIf you have the Athletic feat, you get a +2 bonus on Climb checks.\nA creature with a climb speed has a +8 racial bonus on all Climb checks. The creature must make a Climb check to climb any wall or slope with a DC higher than 0, but it always can choose to take 10, even if rushed or threatened while climbing. If a creature with a climb speed chooses an accelerated climb (see above), it moves at double its climb speed (or at its land speed, whichever is slower) and makes a single Climb check at a -5 penalty. Such a creature retains its Dexterity bonus to Armor Class (if any) while climbing, and opponents get no special bonus to their attacks against it. It cannot, however, use the run action while climbing.\nSynergy: If you have 5 or more ranks in Use Rope, you get a +2 bonus on Climb checks made to climb a rope, a knotted rope, or a rope-and-wall combination.",
  "chunk_version": "v1-section-passthrough",
  "previous_chunk_id": "chunk::srd_35::skillsi::020_bluff_cha",
  "next_chunk_id": "chunk::srd_35::skillsi::022_concentration_con"
}
